Identifiant opération;Localisation station de mesure;Code station;X;Y;Identifiant point prélèvement;Date réalisation;Débit mesuré (m3/s);Débit station hydro (m3/s);Distance interpoint (m);Largeur plein bord évaluée (m);Largeur mouillée évaluée (m);Longueur réelle opération (m);Longueur théorique opération (m);Pente ligne d'eau (‰);Pente ligne d'eau évaluée;Decription habitat marginaux;Continuité ripisylve rive gauche;Continuité ripisylve rive droite;Nom réseau de mesure;Observations;Version protocole;Structure responsable;Cours d'eau;Nombre transect;D16 (mm);D50 (mm);D84 (mm);Indice Folk et Ward;Indice Fredle;Surface mouillée Q1 (m2);Largeur mouillée Q1 (m);Périmètre mouillé Q1 (m);Profondeur maximum Q1 (m);Profondeur moyenne Q1 (m);Rayon hydraulique Q1;Rapport largeur/Profondeur Q1;Coefficient rugosité;Surface mouillée Qb (m2);Largeur mouillée Qb (m);Périmètre mouillé Qb (m);Profondeur maximum Qb (m);Profondeur moyenne Qb (m);Rayon hydraulique Qb;Rapport largeur/Profondeur Qb;Force tractrice Qb  (N/m2);Débit plein bord (m3/s);Ecart type cote point;Coefficient variation cote point;Ecart type cote point en eau;Coefficient variation cote point en eau;Ecart type largeur mouillée Qb;Coefficient variation largeur mouillée Qb;Vitesse moyenne Qb (m/s);Ligne énergie Qb (m);Cote ligne énergie Qb;Nombre de Froude Qb;Puissance spécifique Qb (w/m2);Nombre de mouille;Profondeur moyenne des mouilles (m);Nombre de berge total;Nombre de berge artificialisée;Score ripisylve;Classe ripisylve;% fines;% graviers-cailloux;% blocs-rochers;Indice de Shannon granulo;Surface BV (km2);Proportion de roche imperméable BV;Code HER ou DOM dominant;Nom HER ou DOM dominant;Type DOM;Coefficient de sinuosité;Débit Q01 RHT (m3/s);Puissance Q01 RHT (w/m);Puissance spécifique Q01 RHT (w/m2);Station référence modèle;Résidu modèle Largeur mouillée Qb;Résidu modèle rapport largeur/profondeur Qb;Résidu modèle profondeur mouilles;Résidu modèle profondeur Qb;Résidu modèle pente ligne d'eau;Résidu modèle surface mouillée Qb;Résidu standardisé modèle largeur mouillée Qb;Résidu standardisé modèle rapport largeur/profondeur Qb;Résidu standardisé modèle profondeur mouilles;Résidu standardisé modèle profondeur Qb;Résidu standardisé modèle pente ligne d'eau;Résidu standardisé modèle surface mouillée Qb;IMG;Modèle référence IMG
54;LA ROUVRE A FAVEROLLES 2;3240100;456490;6846252;110896;11/09/2009;0,059;NA;0,53;8,21;3,7;115;114,94;3,04;NA;;4;4;NA;;1;OFFICE FRANCAIS DE LA BIODIVERSITE;Rouvre;14;11,84;23;35,16;0,74;13,289;0,476;3,118;3,229;0,202;0,15;0,144;18,222;8,204;8,829;8,057;9,42;1,768;1,102;0,933;4,579;27,834;3,814;0,723;0,007;0,094;0,612;1,509;0,187;0,446;1,778;101,414;0,136;14,622;2;0,132;28;0;0,548;4;41,837;57,143;1,02;1,906;51,12;0,964;12;ARMORICAIN;0;1.142;3,576;106,645;13,237;0;0,03;-0,43;-0,068;0,446;0,031;0,342;0,138;-1,566;-0,165;2,221;0,03;1,091;5,21;ARMORICAIN
55;LA LAIZE A LAIZE-LA-VILLE 2;3245100;453546;6891060;111298;03/07/2009;0,638;NA;0,75;8,4;5,3;130;117,6;4,8;NA;;5;4;NA;;1;OFFICE FRANCAIS DE LA BIODIVERSITE;Laize;16;42,84;62;123,28;0,76;51,319;1,779;6,26;6,439;0,46;0,291;0,281;15,447;12,054;8,641;9,068;10,098;1,356;0,959;0,858;6,813;40,392;6,515;0,568;0,006;0,154;0,543;1,619;0,179;0,768;1,386;100,624;0,251;34,587;3;0,123;32;5;0,801;3;10;56,429;33,571;1,994;156,13;0,339;12;ARMORICAIN;0;1.033;4,675;220,136;24,275;0;-0,316;-0,205;-0,34;-0,11;1,079;-0,451;-1,458;-0,748;-0,826;-0,546;1,048;-1,44;6,066;ARMORICAIN
56;LA VIRE A TRUTTEMER-LE-GRAND 1;3248401;418806;6860676;111706;02/07/2009;0,06;NA;0,4;4,1;2,9;65;57,4;3,5;NA;;3;4;NA;;1;OFFICE FRANCAIS DE LA BIODIVERSITE;Vire;16;12;18;45,32;0,959;15,247;0,414;2,884;3,044;0,232;0,142;0,133;14,799;9,435;2,674;4,837;5,517;0,842;0,557;0,485;5,853;16,656;0,921;0,358;0,004;0,113;0,782;0,895;0,185;0,357;0,849;100,508;0,155;6,765;4;0,132;32;0;0,213;1;30,769;64,103;5,128;2,005;8,28;1;12;ARMORICAIN;0;1.011;0,953;32,721;6,765;0;0,276;0,097;0,274;0,177;-0,792;0,405;1,276;0,353;0,665;0,88;-0,769;1,293;5,236;ARMORICAIN
57;L'AY A LESSAY 1;3264000;373996;6905728;112740;01/09/2009;0,081;NA;0,4;4,33;2,8;120;60,62;3,3;NA;;4;1;NA;;1;OFFICE FRANCAIS DE LA BIODIVERSITE;Ay;26;12,84;20,5;38,16;0,779;14,875;0,61;3,284;3,5;0,322;0,2;0,182;15,376;7,213;4,625;5,626;6,793;1,236;0,831;0,679;4,675;21,976;1,48;0,505;0,005;0,153;0,829;1,754;0,312;0,339;1,242;100,742;0,119;9,137;5;0,227;52;0;0,162;1;59,13;38,696;2,174;1,748;37,04;1;12;ARMORICAIN;0;1.098;8,399;271,901;48,33;0;-0,195;-0,359;0,538;0,172;-0,058;-0,082;-0,901;-1,308;1,306;0,856;-0,056;-0,262;4,689;ARMORICAIN
58;LA SÉE ROUSSE A SOURDEVAL 2;3269438;412872;6851649;113163;10/06/2009;NA;NA;0,31;2,92;2,189;60;40,88;10;NA;;5;4;NA;;1;OFFICE FRANCAIS DE LA BIODIVERSITE;See rousse;22;17;32;61,64;0,943;21,297;0,329;2,424;2,593;0,227;0,137;0,126;11,658;7,213;1,521;3,247;3,839;0,655;0,468;0,393;5,016;38,506;0,588;0,306;0,003;0,07;0,511;0,797;0,246;0,408;0,664;100,131;0,193;18,524;6;0,11;44;0;1,212;2;23,37;70,652;5,978;1,887;7,43;1;12;ARMORICAIN;0;1.031;1,112;109,087;33,601;0;-0,077;-0,041;0,11;-0,046;0,201;-0,084;-0,356;-0,148;0,266;-0,227;0,195;-0,269;1,461;ARMORICAIN
59;LA SÉLUNE A SAINT-AUBIN-DE-TERREGATTE 1;3272685;384098;6842109;113695;16/06/2009;3,6;NA;2,7;20,2;18,93;443;282,8;2,91;NA;;4;5;NA;;1;OFFICE FRANCAIS DE LA BIODIVERSITE;Selune;21;35;53;84,16;0,604;39,512;8,818;18,904;19,138;0,698;0,487;0,48;29,291;12,353;40,892;25,304;26,325;2,172;1,625;1,557;11,803;44,456;36,609;0,977;0,01;0,228;0,49;6,394;0,253;0,931;2,217;100,931;0,234;43,143;4;0,128;42;0;0,801;2;16,561;79,618;3,822;1,652;771,09;1;12;ARMORICAIN;0;0;0,2;5,709;0,226;0;0,046;0,097;-0,596;-0,053;1,424;-0,001;0,213;0,354;-1,447;-0,264;1,383;-0,002;3,662;ARMORICAIN
87;VONNE à JAZENEUIL;4082740;476011;6599906;119472;26/06/2009;0,45;NA;0;18,07;13,17;0;252,98;2,41;NA;;5;3;NA;;1;OFFICE FRANCAIS DE LA BIODIVERSITE;Vonne;15;29;49;75,32;0,661;36,132;4,142;12,162;12,302;0,511;0,343;0,339;27,274;4,556;14,708;17,087;17,498;1,207;0,873;0,852;14,579;20,132;2,955;0,496;0,005;0,201;0,596;2,478;0,145;0,203;1,209;100,394;0,07;4,162;4;0,117;30;0;NA;1;8,475;83,051;8,475;1,844;252,83;0,647;12;ARMORICAIN;0;1.013;32,075;758,32;44,38;0;0,117;0,481;-0,48;-0,351;0,645;-0,253;0,54;1,75;-1,164;-1,746;0,626;-0,806;6,633;ARMORICAIN
92;RAU DE MAGNEROLLES à NANTEUIL;4158950;458190;6595190;123329;04/06/2009;NA;NA;0;5,23;3,14;0;73,22;16,25;NA;;5;5;NA;;1;OFFICE FRANCAIS DE LA BIODIVERSITE;Rau de magnerolles;15;71,84;117,5;184,16;0,628;82,372;0,325;2,177;2,3;0,23;0,138;0,125;12,906;2,968;1,672;4,502;4,863;0,591;0,365;0,336;8,049;53,589;0,306;0,481;0,005;0,17;1,109;0,905;0,201;0,208;0,593;99,768;0,116;11,295;3;0,179;30;0;NA;1;8,527;58,915;32,558;1,993;91,62;1;12;ARMORICAIN;0;0.941;13,468;2146,968;476,932;0;-0,795;0,044;0,131;-0,802;2,016;-1,726;-3,668;0,159;0,317;-3,994;1,959;-5,507;15,604;ARMORICAIN
94;VAUDELLE à SAINT-GERMAIN-DE-COULAMER;4113050;462302;6801698;121163;23/07/2009;0,244;NA;0,6;5,7;4,43;84;79,8;4,04;NA;;5;3;NA;Eaux colorées suite à précipitations de la veille;1;OFFICE FRANCAIS DE LA BIODIVERSITE;Vaudelle;15;23;61,5;108,16;1,003;30,501;0,818;3,998;4,15;0,348;0,204;0,196;12,595;13,901;3,384;5,553;6,095;0,877;0,612;0,555;6,424;22,011;2,02;0,346;0,003;0,119;0,583;0,592;0,107;0,607;0,896;100,387;0,25;14,582;2;0,189;30;0;0,736;3;27,273;69,091;3,636;2,077;41,8;1;12;ARMORICAIN;0;1.137;3,139;124,406;22,401;0;-0,258;-0,06;0,334;-0,202;0,209;-0,478;-1,193;-0,22;0,81;-1,008;0,203;-1,526;4,96;ARMORICAIN
96;MAYENNE à LALACELLE;4123100;467512;6823781;121682;03/09/2009;0,004;NA;0,3;3,62;2,16;70;50,68;12,6;NA;Fosse d'affouillement avl buse de pont (amont station) + Nombreuses embâcles;4;5;NA;Le débit saisi a été mesuré à l'aval de la station. A mi-station, arrivée d'un exutoire de plan d'eau. Amont du rejet débit mesuré =0.003m3/s;1;OFFICE FRANCAIS DE LA BIODIVERSITE;Mayenne;19;26;46,5;73;0,776;29,82;0,235;1,687;1,784;0,188;0,112;0,102;13,115;0,692;3,193;4,532;5,493;1,115;0,697;0,569;4,094;70,345;0,17;0,524;0,005;0,129;0,944;1,264;0,279;0,059;1,115;100,517;0,023;4,96;6;0,172;38;0;0,801;2;27,891;68,707;3,401;1,927;6,14;1;12;ARMORICAIN;0;1.049;0,789;97,525;21,517;0;0,336;-0,214;0,59;0,536;0,331;0,79;1,55;-0,78;1,432;2,668;0,322;2,519;9,271;ARMORICAIN
97;OISILLY à CHAMPGENETEUX;4124875;449328;6803679;121834;22/07/2009;0,032;NA;0,4;4,07;2,77;57;56,98;9,4;NA;;0;1;NA;Pas de station hydro;1;OFFICE FRANCAIS DE LA BIODIVERSITE;Oisilly;15;22,84;62;124;1,119;28,916;0,204;2,254;2,345;0,166;0,093;0,088;15,867;8,028;1,147;3,386;3,688;0,488;0,345;0,315;7,053;29,023;0,413;0,257;0,003;0,06;0,65;0,941;0,278;0,372;0,495;100,062;0,202;11,945;5;0,064;30;0;0,061;1;45,745;48,936;5,319;2,177;8,99;1;12;ARMORICAIN;0;1.01;0,913;84,191;24,861;0;-0,114;0,271;-0,467;-0,39;0,24;-0,498;-0,527;0,985;-1,133;-1,942;0,233;-1,59;6,41;ARMORICAIN
98;ARON à MOULAY;4124985;445127;6806846;121844;22/07/2009;0,243;0,175;0,7;6,03;5;84;84,42;0,71;NA;;3;3;NA;Débit hydro recalculé au prorata de la surface de BV ????;1;OFFICE FRANCAIS DE LA BIODIVERSITE;Aron;15;22;34;67,32;0,83;24,972;1,61;4,589;4,843;0,508;0,351;0,331;9,751;11,845;5,477;6,058;6,918;1,23;0,906;0,791;4,988;5,511;1,479;0,474;0,005;0,165;0,461;0,468;0,077;0,273;1,234;100,696;0,092;1,71;2;0,229;30;0;0,188;1;53,271;45,794;0,935;2,139;80,5;1;12;ARMORICAIN;0;0;5,237;36,476;6,021;0;-0,444;-0,415;0,401;-0,035;-1,183;-0,449;-2,049;-1,509;0,973;-0,173;-1,149;-1,434;7,288;ARMORICAIN
99;ARGOS à SAINTE-GEMMES-D'ANDIGNE;4131550;409619;6734635;122071;21/07/2009;0,04;0,053;1,18;10;8,26;140;140;0,03;NA;;5;5;NA;"Colmatage par des fines / toute la station
Batons : coloration inverse sur tous les batons";1;OFFICE FRANCAIS DE LA BIODIVERSITE;Argos;15;18;30;44;0,724;21,075;4,476;8,184;8,644;0,702;0,549;0,519;11,848;2,527;15,395;11,092;12,42;1,843;1,393;1,241;6,03;0,365;0,246;0,737;0,007;0,136;0,236;1,117;0,101;0,016;1,843;101,139;0,004;0,007;4;0,071;30;0;0,866;3;15,094;84,906;0;1,64;151,57;1;12;ARMORICAIN;0;1.095;11,701;3,444;0,31;0;-0,102;-0,323;-0,885;0,205;-4,012;0,147;-0,472;-1,175;-2,146;1,022;-3,898;0,468;9,181;ARMORICAIN
100;RAU DE LA VALLEE ou JEANNEAU à RIAILLE;4146418;379406;6724885;72466;15/07/2009;0,018;NA;0,39;3,14;2,73;44;43,96;3,91;NA;;5;5;NA;"Batons radier A non retrouvés
Pas de station hydro à proximité";1;OFFICE FRANCAIS DE LA BIODIVERSITE;Rau de la vallee ou jeanneau;15;13;40;112;1,682;15,852;0,314;2,685;2,774;0,169;0,116;0,112;17,844;3,945;1,899;3,57;4,117;0,657;0,532;0,459;5,471;17,612;0,279;0,253;0,003;0,063;0,538;0,526;0,147;0,151;0,659;100,403;0,066;3,058;5;0,027;30;0;1,516;2;61,905;37,302;0,794;1,775;18,7;1;12;ARMORICAIN;0;0.656;2,22;85,153;23,854;0;-0,366;-0,097;-1,464;-0,282;-0,25;-0,5;-1,689;-0,351;-3,553;-1,406;-0,243;-1,595;8,837;ARMORICAIN
101;RAU DE GESVRES à CHAPELLE-SUR-ERDRE (LA);4146840;352423;6700739;72468;15/07/2009;0,076;NA;0,56;5,6;3,94;78;78,4;1,15;NA;;4;5;NA;Pas de station hydro à proximité;1;OFFICE FRANCAIS DE LA BIODIVERSITE;Rau de gesvres;15;9;14;21,52;0,651;10,373;1,038;3,899;4,162;0,44;0,25;0,234;10,092;5,69;6,876;5,762;7,277;1,609;1,191;0,94;3,605;10,607;1,273;0,584;0,006;0,177;0,669;0,684;0,119;0,19;1,611;101,125;0,056;2,525;5;0,124;30;0;1,418;2;46,825;53,175;0;1,599;54,91;1;12;ARMORICAIN;0;1.124;7,692;86,777;15,06;0;-0,335;-0,68;-0,137;0,333;-0,903;0,042;-1,546;-2,476;-0,332;1,659;-0,878;0,135;7,025;ARMORICAIN
102;LOISANCE À SAINT-OUEN-LA-ROUERIE;4162958;371953;6823463;123774;09/07/2009;NA;0,358;0,5;5,73;4,9;80;80,22;6,75;NA;;3;2;NA;"Rivière courante avec blocs RG prairie fauchée ronces + qqs arbres et arbustes épars  RD plantation de peuplier ronces et qqs arbres nat
Partie amont de la station modifiée : accès percelle + station de jaugeage,
Batons B1 coloration inversée B2 alterné";1;OFFICE FRANCAIS DE LA BIODIVERSITE;Loisance;15;21,68;55;400;1,973;42,582;1,431;5,975;6,124;0,379;0,247;0,24;17,572;7,888;5,318;7,729;8,206;0,938;0,692;0,65;8,428;43,033;2,586;0,374;0,004;0,121;0,506;1,405;0,182;0,498;0,951;100,301;0,191;22,905;5;0,084;30;7;0,162;1;27,857;49,286;22,857;2,006;82,49;1;12;ARMORICAIN;0;1.357;3,185;210,903;27,286;0;-0,211;0,106;-0,605;-0,312;1,082;-0,496;-0,971;0,386;-1,469;-1,555;1,051;-1,583;7,014;ARMORICAIN
103;FLORA à SAINT-ALBAN;4167750;292161;6842216;124258;25/08/2009;0,005;NA;0,4;4,25;2,7;60;59,5;6,7;NA;;4;5;NA;"Petit cours d'eau rectiligne au niveau de la station avec affleurements rocheux. Débit faible et colmatage important par des fines.
RG : prairie paturées avec  bouquets d'arbres et/ou arbustes en alignement
RD : coteaux boisés (roche affleurantes)";1;OFFICE FRANCAIS DE LA BIODIVERSITE;Flora;15;3,84;10;30,32;1,623;5,329;0,407;1,998;2,215;0,297;0,198;0,172;8,475;0,466;3,447;4,116;5,242;1,315;0,842;0,661;3,143;43,417;0,1;0,541;0,005;0,134;0,655;0,717;0,174;0,03;1,315;100,818;0,011;1,635;2;0,262;30;0;0,801;3;21,978;51,648;26,374;2,112;16,03;1;12;ARMORICAIN;0;1.207;1,336;87,811;21,333;0;-0,16;-0,627;0,837;0,451;0,207;0,203;-0,736;-2,282;2,03;2,246;0,201;0,647;8,143;ARMORICAIN
104;TRIEUX à PLESIDY;4171670;250308;6834760;124633;27/08/2009;0,18;0,22;1,2;10,83;8,4;185;151,62;13,2;NA;;2;5;NA;"Rivières courantes parmi de nombreux blocs
RG : prairie avac peupliers en alignement en rive (+ qq bosquets naturels)
RD : bois en aval puis prairie avec peupliers
Longueut station surévaluée
Débit Hydro recalculé au prorata de BV de la station morpho";1;OFFICE FRANCAIS DE LA BIODIVERSITE;Trieux;15;3;75;331,6;3,082;6,324;1,375;6,413;6,585;0,389;0,223;0,215;18,807;3,175;6,223;9,482;9,95;0,975;0,661;0,628;9,989;81,291;1,664;0,721;0,007;0,164;0,741;1,312;0,138;0,273;0,979;99,59;0,108;23,134;3;0,189;30;0;0,671;2;23,853;9,174;66,972;1,528;94,36;1;12;ARMORICAIN;0;1.119;0,702;90,903;9,587;1;-0,062;0,255;0,184;-0,308;1,824;-0,432;-0,286;0,929;0,445;-1,534;1,772;-1,377;6,343;ARMORICAIN
105;LEGUER à PLOUBEZRE;4173100;227473;6859526;124997;18/08/2009;0,832;0,863;2,4;18,83;16,7;270;263,62;3;NA;;3;1;NA;"Rivière courante avec présence de blocs. Sytion à l'aval d'un ancien moulin
RD : parcelle récemment déboisée en aval + petite prairie en amont
RG : prairie paturée en aval + chemin boisé + friche herbacée en amont";1;OFFICE FRANCAIS DE LA BIODIVERSITE;Leguer;15;24,84;50;107,16;1,378;31,228;5,697;15,135;15,395;0,61;0,388;0,38;28,481;5,08;31,711;21,242;22,359;2,015;1,517;1,437;10,702;42,298;11,237;0,843;0,008;0,22;0,572;3,819;0,18;0,358;2,022;101,017;0,093;16,036;5;0,103;30;0;0,137;4;47,321;15,179;37,5;1,685;376,49;1;12;ARMORICAIN;0;1.035;36,596;1077,02;50,702;1;0,169;0,11;-0,685;0,058;1,075;0,24;0,781;0,401;-1,663;0,291;1,044;0,767;4,947;ARMORICAIN
106;KERGOMARD OU GRUGUIL à SAINT-QUAY-PERROS;4173405;227566;6873403;125065;19/08/2009;0,027;NA;0,4;3,2;2,8;45;44,8;4,4;NA;;5;5;NA;"Petit cours d'eau côtier  sinueux coulant en  fond de vallée boisé au niveau de la station.
Pas de station hydro à proximité";1;OFFICE FRANCAIS DE LA BIODIVERSITE;Kergomard ou gruguil;15;18;28;55,64;0,894;21,619;0,308;2,397;2,529;0,201;0,13;0,122;14,315;5,349;1,98;3,519;4,206;0,745;0,564;0,47;4,783;20,27;0,424;0,308;0,003;0,084;0,657;0,54;0,154;0,22;0,748;100,448;0,094;5,323;4;0,08;30;0;1,516;2;34,821;59,821;5,357;1,849;12,78;1;12;ARMORICAIN;0;1.054;0;0;0;0;-0,222;-0,172;-0,308;-0,058;-0,333;-0,195;-1,025;-0,626;-0,748;-0,288;-0,324;-0,622;3,633;ARMORICAIN
107;ABER WRAC'H À LANARVILY;4175100;154569;6854223;125411;08/07/2009;0,373;0,47;1;7,86;7,3;110;110,04;5,64;NA;;3;3;NA;"Stations de part et d'autre d'un pont avec seuil de jaugeage !
Batons A1 et A4 : coloration inversée
Sation hydro J3204030 non encore active, donnée prise sur la J3205710 et correction / surf de BV ???";1;OFFICE FRANCAIS DE LA BIODIVERSITE;Aber wrac'h;15;26,68;61;120;1,1;33,252;3,321;6,571;7,029;0,675;0,497;0,457;11,072;2,522;13,48;8,43;9,676;1,979;1,604;1,37;4,301;75,795;3,149;1,056;0,011;0,255;0,493;2,19;0,26;0,26;1,983;100,998;0,066;22,896;3;0,288;30;6;0,188;1;49,524;40;10,476;2,243;80,22;1;12;ARMORICAIN;0;1.051;6,701;370,756;43,982;0;-0,112;-0,562;0,632;0,442;0,887;0,454;-0,518;-2,047;1,534;2,199;0,862;1,447;8,607;ARMORICAIN
108;ELORN à COMMANA;4177320;182386;6832318;72516;09/07/2009;0,077;0,068;0,43;4,2;3;59;58,8;5,9;NA;;5;5;NA;"Erreur sur la station : il s'agit en fait ici de l'Elorn à Commana (station de Référence et RCS) code Agence 04177320 (et non de l'Elorn à Plouedern code 04178000
Perits cours d'eau forestier issu de tourbières des Monts d'Arrée
Baton A3 non retrouvé";1;OFFICE FRANCAIS DE LA BIODIVERSITE;Elorn;15;47,68;78;181,16;0,918;60,487;0,407;2,992;3,106;0,237;0,142;0,136;14,381;9,334;2,736;4,701;5,34;0,813;0,586;0,513;5,838;29,696;1,257;0,307;0,003;0,091;0,693;0,831;0,177;0,468;0,824;100,413;0,195;15,901;5;0,072;30;0;1,299;2;10,87;71,014;18,116;2,11;9,45;1;12;ARMORICAIN;0;1.14;1,485;85,95;18,282;0;0,193;0,074;-0,354;0,107;-0,199;0,337;0,891;0,269;-0,858;0,534;-0,194;1,075;3,821;ARMORICAIN
109;SARRE à MELRAND;4192550;243433;6785232;127750;15/07/2009;0,23;NA;1,25;13;8,7;185;182;9,6;NA;;5;5;NA;"Rivière courante avec nbx blocs
RG : friche boisée RD : friche boisée + prairie avec alignement d'arbres en rives.
Pas de station hydro.
Batons : coloration inversée. Etonnant mauvais résultat sur cette station de référence";1;OFFICE FRANCAIS DE LA BIODIVERSITE;Sarre;15;75;110;250,8;0,87;100,16;1,615;7,825;7,991;0,403;0,208;0,203;20,947;4,207;6,876;11,061;11,561;0,939;0,625;0,597;12,052;56,18;2,009;0,593;0,006;0,141;0,661;3,522;0,318;0,317;0,944;99,667;0,129;18,573;5;0,081;30;0;1,516;2;18,333;38,333;43,333;1,58;99,1;1;12;ARMORICAIN;0;1.082;8,744;823,475;74,447;0;0,072;0,435;-0,678;-0,359;1,531;-0,366;0,331;1,584;-1,646;-1,788;1,488;-1,167;8,004;ARMORICAIN
110;SEDON à GUEGON;4197818;286275;6772486;128472;16/07/2009;0,113;NA;0,65;6,1;4,4;85;85,4;2,1;NA;;4;4;NA;"Petits cours d'eau au tracé vraisemblablement modifié. Fond de vallée sableux, occupé principalment par des prairies.
RD station : prairies avec nbx saules en rive
RG station : petit coteau boisé puis prairie bordée de saules.
Pas de station hydro";1;OFFICE FRANCAIS DE LA BIODIVERSITE;Sedon;15;9;16;22,16;0,612;10,473;0,783;3,721;3,886;0,322;0,206;0,196;13,321;9,35;6,784;6,514;7,553;1,44;1,046;0,898;4,562;18,492;2,704;0,557;0,006;0,147;0,692;0,958;0,147;0,406;1,449;101,037;0,127;8,713;4;0,2;30;0;0,736;3;67,797;32,203;0;1,341;62,03;1;12;ARMORICAIN;0;1.223;4,114;84,753;13,011;0;-0,263;-0,464;0,315;0,191;-0,237;-0,055;-1,214;-1,687;0,765;0,949;-0,23;-0,177;5,022;ARMORICAIN
111;AFF à PAIMPONT;4199370;315433;6777126;128619;08/07/2009;NA;0,037;0,5;5,07;3,4;71;70,98;2,6;NA;;5;5;NA;"Petit cours d'eau forestier, shiste affleurant, débit faible
Batons : couleur ""gris clair uniforme""  pour l'ensemble des batons";1;OFFICE FRANCAIS DE LA BIODIVERSITE;Aff;15;6;17;42;1,42;8,032;0,376;2,973;3,062;0,195;0,125;0,12;19,181;7,937;4,118;5,649;6,532;1,055;0,738;0,635;5,427;16,192;1,231;0,418;0,004;0,092;0,753;0,769;0,136;0,302;1,059;100,772;0,114;5,66;4;0,09;30;0;1,516;2;22,222;46,032;31,746;2,027;27,37;1;12;ARMORICAIN;0;1.155;3,032;77,334;13,689;0;-0,065;-0,164;-0,337;0,092;-0,456;0,011;-0,302;-0,596;-0,818;0,456;-0,443;0,034;2,649;ARMORICAIN
112;VILAINE à BOURGON;4200595;399038;6795288;128810;24/07/2009;0,108;0,174;0,5;5,9;3,5;84;82,6;6,07;NA;;4;4;NA;;1;OFFICE FRANCAIS DE LA BIODIVERSITE;Vilaine;15;29,84;53;80;0,789;35,281;0,953;3,891;4,075;0,381;0,23;0,215;13,434;4,052;4,281;6,158;6,78;1,026;0,705;0,633;6,241;37,695;0,996;0,442;0,004;0,224;0,938;1,583;0,257;0,246;1,029;100,397;0,096;10,032;2;0,406;30;0;0,736;3;19,149;75,177;5,674;2,034;57,63;1;12;ARMORICAIN;0;1.469;5,655;336,737;54,679;0;-0,289;-0,139;1,037;-0,129;0,786;-0,465;-1,332;-0,506;2,516;-0,644;0,764;-1,484;7,245;ARMORICAIN
113;ILLE à MONTREUIL-SUR-ILLE;4205500;353285;6813195;128981;07/07/2009;NA;0,25;0,45;5,65;3,1;80;79,1;0,87;NA;;0;3;NA;"Cours d'eau sinueux recalibré dans les années 80
RG prairie humide paturée sans ripisylve RD prairie avec qqs vieux chênes épars
Incertitude / débit recalculé au prorata du BV
Batons A1 A2 A3 coloration alterbée BNB (+18 +8 +18)";1;OFFICE FRANCAIS DE LA BIODIVERSITE;Ille;15;4;13;22;1,351;6,211;0,658;3,117;3,287;0,325;0,21;0,198;10,109;37,897;4,801;5,944;6,813;1,232;0,813;0,708;4,852;6,039;4,262;0,448;0,004;0,095;0,434;0,468;0,079;0,893;1,273;100,914;0,319;6,152;3;0,106;30;0;0,296;3;90,798;8,589;0,613;1,28;69,46;0,992;12;ARMORICAIN;0;1.469;3,895;33,243;5,592;0;-0,402;-0,42;-0,336;0,005;-1,058;-0,479;-1,853;-1,527;-0,816;0,026;-1,028;-1,529;6,78;ARMORICAIN
114;CHERE à CHATEAUBRIANT;4214000;369522;6744479;129342;16/07/2009;0,075;0,053;0,76;7,5;5,3;105;105;0,4;NA;;1;1;NA;Batons  A4 B1 B2 B3 B4 non retrouvés;1;OFFICE FRANCAIS DE LA BIODIVERSITE;Chere;15;2,84;10;18;1,379;4,023;1,39;3,714;4,012;0,491;0,359;0,33;7,898;5,648;6,07;7,3;8,182;1,351;0,829;0,738;5,448;2,896;0,56;0,534;0,005;0,16;0,399;0,684;0,094;0,096;1,351;100,839;0,035;0,303;5;0,063;30;0;0,087;4;56,164;43,836;0;1,619;63,87;1;12;ARMORICAIN;0;1.011;6,544;25,679;3,518;0;-0,161;-0,291;-0,852;0,119;-1,879;-0,187;-0,744;-1,059;-2,066;0,592;-1,826;-0,596;6,883;ARMORICAIN
219;CANUT (NORD) À LASSY;4211550;337884;6773670;129264;17/06/2010;0,118;0,031;1,1;8,75;7,6;122,5;NA;3,5;NA;;3;2;NA;"Protocole à la suite PE RCS
Baton A4 non retrouvé";2;OFFICE FRANCAIS DE LA BIODIVERSITE;Canut (nord);15;15,84;44;71,16;1,01;19,532;1,2;5,954;6,076;0,3;0,207;0,202;27,182;4,837;7,462;8,355;9,031;1,157;0,905;0,833;7,446;28,601;1,89;0,478;0,005;0,148;0,714;1,503;0,18;0,258;1,16;100,646;0,087;8,006;2;0,25;30;0;0,162;4;11,236;85,393;3,371;1,826;100,05;1;12;ARMORICAIN;0;1.198;6,418;220,362;26,374;0;-0,213;-0,048;0,45;-0,152;0,527;-0,29;-0,982;-0,174;1,092;-0,759;0,512;-0,927;4,447;ARMORICAIN
220;ILLET à ERCE-PRES-LIFFRE;4205605;367211;6803916;128994;26/08/2010;0,01;0,066;0,35;3;2,5;42;NA;0,05;NA;;3;3;NA;;2;OFFICE FRANCAIS DE LA BIODIVERSITE;Illet;15;14;33;60,16;1,059;15,943;0,398;2,246;2,414;0,243;0,173;0,16;10,814;12,089;2,892;3,389;4,525;1,131;0,853;0,636;3,013;0,312;0,183;0,481;0,005;0,086;0,484;0,442;0,13;0,065;1,131;100,887;0,023;0,027;3;0,096;30;0;0,188;4;58,586;37,374;4,04;2,041;25,6;1;12;ARMORICAIN;0;1.054;1,712;0,84;0,248;0;-0,549;-0,742;-0,25;0,179;-4,443;-0,296;-2,532;-2,699;-0,608;0,889;-4,316;-0,945;11,99;ARMORICAIN
221;COUESNON à ROMAZY;4162300;366702;6817922;123711;25/08/2010;485;557;2;16;14;224;NA;1,9;NA;;4;1;NA;Baton A1 non retrouvé;2;OFFICE FRANCAIS DE LA BIODIVERSITE;Couesnon;15;17,84;36,5;70,8;1,012;23,693;3,368;12,438;12,572;0,404;0,271;0,268;33,115;7946,515;28,001;16,655;18,139;2,072;1,686;1,545;8,062;28,793;12961,183;0,819;0,008;0,15;0,572;1,81;0,109;466,865;11196,883;11296,266;115,073;14648,806;2;0,168;30;0;0,397;4;8,491;84,906;6,604;1,786;521,24;0,998;12;ARMORICAIN;0;1.125;33,106;617,063;37,049;0;-0,209;-0,224;-0,251;0,002;0,79;-0,109;-0,966;-0,813;-0,608;0,008;0,767;-0,347;3,51;ARMORICAIN
236;ERVE à CHAMMES;4119750;449521;6781330;121598;23/08/2010;0,223;0,213;0,85;8;6;112;NA;3;NA;;3;3;NA;Station hydro situé à Voutré (quelques km en amont);2;OFFICE FRANCAIS DE LA BIODIVERSITE;Erve;15;31;47;67;0,53;34,084;1,483;5,953;6,099;0,365;0,241;0,233;18,111;7,244;6,152;8,199;8,74;1,013;0,754;0,7;8,206;20,594;1,924;0,405;0,004;0,141;0,562;2,307;0,281;0,34;1,019;100,486;0,126;7,464;3;0,19;30;4;0,188;4;25;60,714;14,286;2,086;102,04;1;12;ARMORICAIN;0;1.316;7,487;220,342;26,874;0;-0,24;0,046;0,173;-0,291;0,384;-0,497;-1,107;0,169;0,421;-1,448;0,373;-1,587;5,104;ARMORICAIN
237;BLAVET à KERIEN;4190650;237735;6828361;127529;12/07/2010;0,059;0,043;0,47;4,5;3,3;63;NA;4,9;NA;;3;4;NA;;2;OFFICE FRANCAIS DE LA BIODIVERSITE;Blavet;15;5;13,5;62,16;1,775;6,934;0,526;3,268;3,417;0,261;0,158;0,149;15,349;5,702;4,108;5,339;6,304;1,073;0,775;0,653;5,037;31,368;1,233;0,432;0,004;0,115;0,71;0,774;0,145;0,308;1,078;100,656;0,113;11,363;3;0,2;30;0;0,213;1;64,348;33,913;1,739;1,68;19,17;1;12;ARMORICAIN;0;1.317;1,778;85,467;16,008;0;0,026;-0,183;0,533;0,201;-0,011;0,254;0,121;-0,666;1,294;1,002;-0,011;0,812;3,906;ARMORICAIN
238;ARZ à MOLAC;4199865;293236;6749116;128778;27/09/2010;NA;0,033;1,2;12,5;8,1;175;NA;2,6;NA;;4;3;NA;"Etiage sévère
Bâton A1 non retrouvé";2;OFFICE FRANCAIS DE LA BIODIVERSITE;Arz;15;10,84;23;43,16;1,111;13,631;1,735;7,608;7,722;0,32;0,215;0,211;28,824;1,051;13,654;11,904;12,753;1,499;1,144;1,066;8,009;27,181;0,764;0,589;0,006;0,145;0,628;2,045;0,172;0,058;1,499;100,951;0,018;1,676;3;0,178;30;0;0,671;3;41,964;50;8,036;1,925;161,4;1;12;ARMORICAIN;0;1.133;16,76;427,481;35,91;0;-0,058;-0,049;0,021;-0,018;0,483;-0,017;-0,266;-0,178;0,052;-0,089;0,469;-0,054;1,107;ARMORICAIN
239;AFF à QUELNEUC;4199490;322522;6759790;128687;27/09/2010;NA;0,056;1,4;14;9,6;196;NA;1,6;NA;;4;3;NA;"Réalisation reportée pour raison météo
Etiage sévère
Débit non mesuré faute de temps et station de mesure toute proche";2;OFFICE FRANCAIS DE LA BIODIVERSITE;Aff;15;8,84;16;31,16;0,947;10,497;1,168;8,831;8,884;0,235;0,13;0,129;42,917;4,692;15,982;15,922;16,6;1,305;1,015;0,971;12,287;15,236;2,94;0,46;0,005;0,087;0,68;3,415;0,214;0,188;1,307;100,915;0,06;3,009;6;0,084;30;1;0,671;3;21,678;77,622;0,699;1,937;345,58;1;12;ARMORICAIN;0;1.249;33,413;524,45;32,938;0;-0,083;0,261;-0,875;-0,354;0,401;-0,386;-0,385;0,951;-2,122;-1,764;0,389;-1,23;6,842;ARMORICAIN
240;PONT DU ROC'H OU GOAH GUILLERM À NOSTANG;4194500;237244;6758858;127859;28/09/2010;0,044;NA;1,1;9,5;7,9;133;NA;3,2;NA;;3;3;NA;"Opération effectuée à la suite de la PE
Pas de station hydrométrique sur ce cours d'eau";2;OFFICE FRANCAIS DE LA BIODIVERSITE;Pont du roc'h ou goah guillerm;15;4,84;20,5;41;1,669;6,3;1,05;5,741;5,848;0,292;0,184;0,179;31,739;2,335;6,388;8,5;9,147;0,995;0,763;0,706;9,005;22,17;0,669;0,399;0,004;0,164;0,91;1,696;0,2;0,109;0,996;100,491;0,04;2,572;2;0,313;30;3;0,606;3;31,373;44,118;24,51;2,046;53,35;1;12;ARMORICAIN;0;1.048;6,846;214,91;25,283;0;0,066;0,24;0,791;-0,14;0,105;-0,011;0,303;0,872;1,919;-0,695;0,102;-0,036;3,928;ARMORICAIN
